{
  "baselineRunnerVersion": "retrieval-baseline-runner/1.0.0",
  "caseCounts": {
    "noEligibleRetrieval": 5,
    "normalization": 20,
    "positiveRetrieval": 25,
    "retrieval": 30
  },
  "catalog": {
    "semanticDigest": "4819dd94cb1bbe5e27c31ca5ca55976da1442987a792bf438d96681021cb8634",
    "version": "public-v1"
  },
  "corpus": {
    "id": "retrieval-v1",
    "semanticDigest": "f92eac1a3963c4f52fb135189e82a0196dbccd559af32bc57a6a7e64226eb842",
    "version": "retrieval-evaluation-corpus/1.0.0"
  },
  "equivalenceAuthority": {
    "groupCount": 0,
    "version": "retrieval-equivalence-authority/1.0.0"
  },
  "goldStatus": "proposed-not-reviewed",
  "measurementStatement": "Development measurements against proposed, not independently reviewed authority; not production-retrieval quality evidence.",
  "ordinaryBaselines": [
    {
      "aggregateMetrics": {
        "familyCoverage": {
          "denominator": 5,
          "numerator": 5,
          "status": "applicable",
          "value": 1
        },
        "macro": {
          "aliasExpansionCorrectness": {
            "denominator": 5,
            "numerator": 5,
            "status": "applicable",
            "value": 1
          },
          "clarificationAccuracy": {
            "denominator": 20,
            "numerator": 20,
            "status": "applicable",
            "value": 1
          },
          "hardFilterAccuracy": {
            "denominator": 30,
            "numerator": 30,
            "status": "applicable",
            "value": 1
          },
          "meanReciprocalRank": {
            "denominator": 25,
            "numerator": 19.75,
            "status": "applicable",
            "value": 0.79
          },
          "ndcgAt10": {
            "denominator": 25,
            "numerator": 15.652132,
            "status": "applicable",
            "value": 0.626085
          },
          "noEligibleCandidateAccuracy": {
            "denominator": 30,
            "numerator": 30,
            "status": "applicable",
            "value": 1
          },
          "prohibitedConstraintPreservation": {
            "denominator": 10,
            "numerator": 10,
            "status": "applicable",
            "value": 1
          },
          "recallAt10": {
            "denominator": 25,
            "numerator": 13.307363,
            "status": "applicable",
            "value": 0.532295
          }
        },
        "micro": {
          "aliasExpansionCorrectness": {
            "denominator": 5,
            "numerator": 5,
            "status": "applicable",
            "value": 1
          },
          "clarificationAccuracy": {
            "denominator": 20,
            "numerator": 20,
            "status": "applicable",
            "value": 1
          },
          "equivalenceDuplicateRate": {
            "denominator": 300,
            "numerator": 0,
            "status": "applicable",
            "value": 0
          },
          "exactDuplicateRate": {
            "denominator": 300,
            "numerator": 0,
            "status": "applicable",
            "value": 0
          },
          "hardFilterAccuracy": {
            "denominator": 4500,
            "numerator": 4500,
            "status": "applicable",
            "value": 1
          },
          "noEligibleCandidateAccuracy": {
            "denominator": 30,
            "numerator": 30,
            "status": "applicable",
            "value": 1
          },
          "prohibitedConstraintPreservation": {
            "denominator": 15,
            "numerator": 15,
            "status": "applicable",
            "value": 1
          },
          "recallAt10": {
            "denominator": 400,
            "numerator": 191,
            "status": "applicable",
            "value": 0.4775
          }
        }
      },
      "baselineId": "family-only",
      "baselineVersion": "retrieval-family-only-baseline/1.0.0",
      "candidateDecisionCount": 4500,
      "emittedResultCount": 300,
      "perFamily": [
        {
          "family": "authorization",
          "metrics": {
            "aliasExpansionCorrectness": {
              "denominator": 1,
              "numerator": 1,
              "status": "applicable",
              "value": 1
            },
            "clarificationAccuracy": {
              "denominator": 4,
              "numerator": 4,
              "status": "applicable",
              "value": 1
            },
            "equivalenceDuplicateRate": {
              "denominator": 60,
              "numerator": 0,
              "status": "applicable",
              "value": 0
            },
            "exactDuplicateRate": {
              "denominator": 60,
              "numerator": 0,
              "status": "applicable",
              "value": 0
            },
            "hardFilterAccuracy": {
              "denominator": 900,
              "numerator": 900,
              "status": "applicable",
              "value": 1
            },
            "meanReciprocalRank": {
              "denominator": 5,
              "numerator": 4.25,
              "status": "applicable",
              "value": 0.85
            },
            "ndcgAt10": {
              "denominator": 5,
              "numerator": 3.649674,
              "status": "applicable",
              "value": 0.729935
            },
            "noEligibleCandidateAccuracy": {
              "denominator": 6,
              "numerator": 6,
              "status": "applicable",
              "value": 1
            },
            "positiveCaseHitRate": {
              "denominator": 5,
              "numerator": 5,
              "status": "applicable",
              "value": 1
            },
            "prohibitedConstraintPreservation": {
              "denominator": 3,
              "numerator": 3,
              "status": "applicable",
              "value": 1
            },
            "recallAt10": {
              "denominator": 5,
              "numerator": 3.431372,
              "status": "applicable",
              "value": 0.686274
            }
          },
          "positiveCases": 5,
          "retrievalCases": 6,
          "safety": {
            "hardFilterErrors": 0,
            "top10Violations": {
              "conflict": 0,
              "laneError": 0,
              "negativeControl": 0
            }
          }
        },
        {
          "family": "audit-logging",
          "metrics": {
            "aliasExpansionCorrectness": {
              "denominator": 1,
              "numerator": 1,
              "status": "applicable",
              "value": 1
            },
            "clarificationAccuracy": {
              "denominator": 4,
              "numerator": 4,
              "status": "applicable",
              "value": 1
            },
            "equivalenceDuplicateRate": {
              "denominator": 60,
              "numerator": 0,
              "status": "applicable",
              "value": 0
            },
            "exactDuplicateRate": {
              "denominator": 60,
              "numerator": 0,
              "status": "applicable",
              "value": 0
            },
            "hardFilterAccuracy": {
              "denominator": 900,
              "numerator": 900,
              "status": "applicable",
              "value": 1
            },
            "meanReciprocalRank": {
              "denominator": 5,
              "numerator": 4,
              "status": "applicable",
              "value": 0.8
            },
            "ndcgAt10": {
              "denominator": 5,
              "numerator": 2.499803,
              "status": "applicable",
              "value": 0.499961
            },
            "noEligibleCandidateAccuracy": {
              "denominator": 6,
              "numerator": 6,
              "status": "applicable",
              "value": 1
            },
            "positiveCaseHitRate": {
              "denominator": 5,
              "numerator": 4,
              "status": "applicable",
              "value": 0.8
            },
            "prohibitedConstraintPreservation": {
              "denominator": 3,
              "numerator": 3,
              "status": "applicable",
              "value": 1
            },
            "recallAt10": {
              "denominator": 5,
              "numerator": 1.721016,
              "status": "applicable",
              "value": 0.344203
            }
          },
          "positiveCases": 5,
          "retrievalCases": 6,
          "safety": {
            "hardFilterErrors": 0,
            "top10Violations": {
              "conflict": 0,
              "laneError": 0,
              "negativeControl": 0
            }
          }
        },
        {
          "family": "background-jobs",
          "metrics": {
            "aliasExpansionCorrectness": {
              "denominator": 1,
              "numerator": 1,
              "status": "applicable",
              "value": 1
            },
            "clarificationAccuracy": {
              "denominator": 4,
              "numerator": 4,
              "status": "applicable",
              "value": 1
            },
            "equivalenceDuplicateRate": {
              "denominator": 60,
              "numerator": 0,
              "status": "applicable",
              "value": 0
            },
            "exactDuplicateRate": {
              "denominator": 60,
              "numerator": 0,
              "status": "applicable",
              "value": 0
            },
            "hardFilterAccuracy": {
              "denominator": 900,
              "numerator": 900,
              "status": "applicable",
              "value": 1
            },
            "meanReciprocalRank": {
              "denominator": 5,
              "numerator": 4,
              "status": "applicable",
              "value": 0.8
            },
            "ndcgAt10": {
              "denominator": 5,
              "numerator": 3.080184,